{
  "id": "site-health-example-0001",
  "kind": "site-health",
  "mvp_status": "Frozen for MVP",
  "sourceContractSection": "§19, §19.1, §19.3, §19A",
  "sourceCatalogId": "OC-12",
  "validationRuleRefs": ["VR-13", "VR-17", "VR-21", "VR-22"],
  "ownerCategory": "PCC Admin",
  "healthRecordId": "hr-example-0001",
  "ProjectId": "pid-26-000-00",
  "checkId": "site-exists",
  "checkName": "Site exists",
  "driftedResourceRef": "/sites/26000",
  "state": "Pass",
  "severity": "Info",
  "repairTier": "T1 Auto",
  "detectedAt": "2026-01-20T08:00:00Z",
  "lastChecked": "2026-01-20T08:00:00Z",
  "detail": "Site present and reachable.",
  "repairAvailable": false,
  "repairAction": "",
  "repairApprovalStatus": "None",
  "repairExecuted": false,
  "beforeAuditState": "{}",
  "afterAuditState": "{}",
  "auditTrail": []
}
